{
  "claim_boundary": {
    "archive_address_is_canonical_physical_representation": false,
    "empty_domain_is_actual_active_support": false,
    "fixed_h0_data_is_decay": false,
    "lebesgue_ae_is_named_fixed_atom": false,
    "phase_average_is_named_fixed_atom": false,
    "prime_pair_lower_bound": false,
    "program_positive_L2": false,
    "scoped_method_stop_is_pointwise_route_stop": false,
    "strict_one_over_400": false,
    "twin_prime_theorem": false
  },
  "classification": "INTEGRATION_L1",
  "endpoint_ledger": {
    "named_atom_sigma_credit": {
      "denominator": 1,
      "numerator": 0
    },
    "required_strict_budget": {
      "denominator": 400,
      "numerator": 1
    },
    "state": "UNPAID"
  },
  "fixed_atom_decay_obtained": false,
  "fixed_h0": {
    "semantics": "SOURCE_BACKED_DATA_FACT_ONLY",
    "value": 2
  },
  "paper": 191,
  "progress": {
    "L0": true,
    "L1": true,
    "L2": false
  },
  "proof": "The imported verdicts are: TPC-188 switches after the size-only and uncontrolled metric methods fail in scope; TPC-189 freezes the direct contract; TPC-190 stops Parseval-to-atom only.  Each payload has L2=false, zero named-atom credit, and no route-stop flag.  Therefore both theorem nodes stay open while precisely the three named method cells are stopped.",
  "required_quantifier_signature": {
    "carrier_axis": "ACTUAL_FIXED_H0_PACKET",
    "decay_axis": "FIXED_X_POWER_FIXED_ATOM",
    "endpoint_axis": "DETERMINISTIC_ALL_PREFIX",
    "phase_axis": "NAMED_FIXED_ATOM",
    "scale_axis": "DETERMINISTIC_ALL_SCALE",
    "support_axis": "ACTUAL_ACTIVE_SUPPORT"
  },
  "result": "The bad-endpoint route reduces exactly to fixed-atom local oscillation; the direct route requires pointwise arithmetic beyond Parseval.  Size-only and uncontrolled metric-to-atom methods are scoped stops, not route stops.  Neither parent is closed and the named-atom endpoint ledger remains at zero.",
  "schema_id": "tpc-191-pointwise-frontier-integration-v1",
  "selected_route": "BOTH_O161_POINTWISE_PARENTS",
  "smallest_literal_missing_theorem": "LITERAL_FIXED_ATOM_ARITHMETIC_CANCELLATION",
  "source_locks": [
    {
      "hash_is_theorem_evidence": false,
      "path": "papers/tpc-182-mvp8-source-phase-route-decision/experiments/tpc182_mvp8_snapshot.json",
      "sha256": "9a0fda83836fe0622783849caa87197d74b66facc36742e7caab46b7c702df0d",
      "source_id": "TPC182.snapshot"
    },
    {
      "hash_is_theorem_evidence": false,
      "path": "papers/tpc-161-source-locked-occurrence-return-integration/experiments/tpc161_occurrence_return_manifest.json",
      "sha256": "ba562b20e968efa6343e02489162820228cc1b695ef7c73b8bd38ab9314c672f",
      "source_id": "TPC161.manifest"
    },
    {
      "hash_is_theorem_evidence": false,
      "path": "papers/tpc-171-source-locked-occurrence-phase-return-integration/experiments/tpc171_integration_manifest.json",
      "sha256": "472d1593bf1557857a25f64b39062149e592f4e872cf2f7494edb9824bcc9693",
      "source_id": "TPC171.manifest"
    },
    {
      "hash_is_theorem_evidence": false,
      "path": "papers/tpc-181-metric-fixed-atom-selector-gate/experiments/tpc181_selector_gate.json",
      "sha256": "e7f0ce222e3d74c354f3c4878d77e4f2ce048c8cf620c76da6b9908e9e346cd9",
      "source_id": "TPC181.selector_gate"
    }
  ],
  "stop_scoped": null,
  "theorem": "Integrated frontier theorem: all new implications are deterministic L1 interface results.  No literal physical coefficient theorem, actual-support certificate, canonical representation, or fixed-atom power has been added.",
  "title": "Integration of the Two Pointwise Fixed-Atom Audits",
  "verdict": "BOTH_POINTWISE_ROUTES_OPEN_METHODS_SCOPED"
}
